<?xml version="1.0" encoding="UTF-8"?>
<config-description:config-descriptions
	xmlns:xsi="http://www.w3.org/2001/XMLSchema-instance"
	xmlns:config-description="http://eclipse.org/smarthome/schemas/config-description/v1.0.0"
	xsi:schemaLocation="http://eclipse.org/smarthome/schemas/config-description/v1.0.0 http://eclipse.org/smarthome/schemas/config-description-1.0.0.xsd">

	<config-description uri="mqtt:homie_channel">
		<parameter name="unit" type="text">
			<label>Unit</label>
			<description>The channels unit</description>
			<default></default>
		</parameter>
		<parameter name="name" type="text">
			<label>Name</label>
			<description>The channel name</description>
			<default></default>
		</parameter>
		<parameter name="settable" type="text">
			<label>Settable</label>
			<description>Is this channel writable?</description>
			<default>true</default>
		</parameter>
		<parameter name="retained" type="text">
			<label>Retained</label>
			<description>If set to false, the resulting channel will be a trigger channel (stateless), useful for non-permanent events. This flag corresponds to the retained option for MQTT publish.</description>
			<default>true</default>
		</parameter>
		<parameter name="format" type="text">
			<label>Format</label>
			<description>The output format.</description>
			<default></default>
		</parameter>
		<parameter name="datatype" type="text">
			<label>Data Type</label>
			<description>The data type of this channel.</description>
			<default>unknown</default>
			<options>
				<option value="integer_">Integer</option>
				<option value="float_">Float</option>
				<option value="boolean_">Boolean</option>
				<option value="string_">String</option>
				<option value="enum_">Enumeration</option>
				<option value="color_">Colour</option>
			</options>
		</parameter>
	</config-description>
</config-description:config-descriptions>
