<?xml version="1.0" encoding="UTF-8"?>
<config-description:config-descriptions
	xmlns:xsi="http://www.w3.org/2001/XMLSchema-instance"
	xmlns:config-description="http://eclipse.org/smarthome/schemas/config-description/v1.0.0"
	xsi:schemaLocation="http://eclipse.org/smarthome/schemas/config-description/v1.0.0
        http://eclipse.org/smarthome/schemas/config-description-1.0.0.xsd">

	<config-description uri="ui:basic">
		<parameter name="iconType" type="text" required="true">
			<label>Icon Format</label>
			<description>Defines whether bitmap or vector icons are used by the UI.</description>
			<options>
				<option value="png">Bitmap</option>
				<option value="svg">Vector</option>
			</options>
		</parameter>
		<parameter name="enableIcons" type="text" required="true">
			<label>Enable Icons</label>
			<description>Defines whether UI renders icons for the widgets or not.</description>
			<options>
				<option value="true">Enable</option>
				<option value="false">Disable</option>
			</options>
		</parameter>
		<parameter name="defaultSitemap" type="text" required="false">
			<label>Default Sitemap</label>
			<description>The sitemap to show if no parameter is passed.</description>
		</parameter>
	</config-description>

</config-description:config-descriptions>